{
	"schemaVersion": "1.0",
	"deckId": "deck-demo",
	"canvas": { "width": 1920, "height": 1080 },
	"theme": {
		"version": "1.0",
		"palette": { "primary": "#2563EB", "text": "#111827" },
		"typography": { "heading": "Inter", "body": "Inter" },
		"background": "#FFFFFF"
	},
	"slides": [
		{
			"id": "slide-1",
			"name": "Opening",
			"elements": [
				{
					"id": "text-1",
					"type": "text",
					"frame": { "x": 160, "y": 180, "width": 1200, "height": 180 },
					"visible": true,
					"locked": false,
					"content": "Quiet Precision",
					"fontFamily": "Inter",
					"fontSize": 72,
					"weight": 700,
					"color": "#111827",
					"align": "left",
					"lineHeight": 1.1
				},
				{
					"id": "shape-1",
					"type": "shape",
					"frame": { "x": 160, "y": 420, "width": 520, "height": 12 },
					"visible": true,
					"locked": false,
					"shape": "rect",
					"fill": "#2563EB",
					"stroke": "#2563EB",
					"strokeWidth": 0,
					"opacity": 1
				}
			]
		}
	],
	"comments": [
		{
			"id": "comment-1",
			"slideId": "slide-1",
			"anchor": { "x": 0.5, "y": 0.5 },
			"text": "Refine the opening",
			"resolved": false
		}
	]
}
